{
  "schema_version": "1.0.0",
  "source_document": "Senior_Project 2026_sem1_activities.pdf",
  "source_file_present": false,
  "transcription_status": "PENDING_VISUAL_VERIFICATION",
  "timezone": "Asia/Bangkok",
  "immutable": true,
  "deadlines": [
    {
      "deadline_id": "DL-0001",
      "name": "Group Application",
      "official_date_start": "2026-08-14",
      "official_date_end": "2026-08-14",
      "official_time": "23:55",
      "planning_deadline": "2026-08-14T23:55:00+07:00",
      "condition": "Required if the group application has not already been submitted",
      "requirements": "Senior Project Group Application",
      "status": "SUBMITTED"
    },
    {
      "deadline_id": "DL-0002",
      "name": "Project Idea",
      "official_date_start": "2026-08-28",
      "official_date_end": "2026-08-28",
      "official_time": null,
      "planning_deadline": "2026-08-28T00:00:00+07:00",
      "condition": null,
      "requirements": "2-4 pages plus references",
      "status": "IN_PROGRESS"
    },
    {
      "deadline_id": "DL-0003",
      "name": "CITI",
      "official_date_start": "2026-09-25",
      "official_date_end": "2026-09-25",
      "official_time": null,
      "planning_deadline": "2026-09-25T00:00:00+07:00",
      "condition": null,
      "requirements": "Required CITI completion and evidence",
      "status": "NOT_STARTED"
    },
    {
      "deadline_id": "DL-0004",
      "name": "Proposal Report",
      "official_date_start": "2026-10-02",
      "official_date_end": "2026-10-02",
      "official_time": null,
      "planning_deadline": "2026-10-02T00:00:00+07:00",
      "condition": null,
      "requirements": "Official proposal report",
      "status": "NOT_STARTED"
    },
    {
      "deadline_id": "DL-0005",
      "name": "Proposal Presentation",
      "official_date_start": "2026-10-08",
      "official_date_end": "2026-10-09",
      "official_time": null,
      "planning_deadline": "2026-10-08T00:00:00+07:00",
      "condition": null,
      "requirements": "Official proposal presentation window",
      "status": "NOT_STARTED"
    },
    {
      "deadline_id": "DL-0006",
      "name": "Progress Report",
      "official_date_start": "2026-12-04",
      "official_date_end": "2026-12-04",
      "official_time": null,
      "planning_deadline": "2026-12-04T00:00:00+07:00",
      "condition": null,
      "requirements": "Official progress report",
      "status": "NOT_STARTED"
    },
    {
      "deadline_id": "DL-0007",
      "name": "Progress Presentation",
      "official_date_start": "2026-12-14",
      "official_date_end": "2026-12-15",
      "official_time": null,
      "planning_deadline": "2026-12-14T00:00:00+07:00",
      "condition": null,
      "requirements": "Official progress presentation window",
      "status": "NOT_STARTED"
    }
  ]
}

